{
  "schema_version": "1.0",
  "_id": "66666666-6666-4666-8666-666666666661",
  "record_kind": "review",
  "parent_item_id": "019997c0-0000-7000-8000-000000000003",
  "source": {
    "source_id": "catalog_ua_rozetka",
    "source_item_id": "review-9001"
  },
  "content_version": "2026-08-30T09:00:00Z",
  "published_at": "2026-08-30T09:00:00Z",
  "updated_at": null,
  "observed_at": "2026-09-01T11:59:00Z",
  "projection_task_id": "11111111-1111-4111-8111-111111111111",
  "lineage": {
    "fetch_id": "22222222-2222-4222-8222-222222222222",
    "raw_sha256": "bbbbbbbbbbbbbbbbbbbbbbbbbbbbbbbbbbbbbbbbbbbbbbbbbbbbbbbbbbbbbbbb",
    "parser_version": "catalog-parser/1.0.0",
    "projection_task_id": "11111111-1111-4111-8111-111111111111"
  }
}
